question,ideal_answer,keywords
What is supervised learning?,Supervised learning is a machine learning technique where a model learns from labelled data to make predictions.,labelled data;training;prediction
What is overfitting?,Overfitting occurs when a model learns the training data too well and performs poorly on unseen data.,training data;generalization;model
What is underfitting?,Underfitting occurs when a model fails to learn patterns from data.,model;learning;pattern
What is normalization?,Normalization scales data into a common range.,scaling;feature;data
What is accuracy?,Accuracy measures the percentage of correct predictions.,prediction;metric;accuracy